{
  "id": "FEAT-0001",
  "name": "Company Profile Management",
  "description": "Enable users to create, view, and edit detailed company profiles with comprehensive business information.",
  "moduleId": "MOD-0001",
  "status": "in-progress",
  "prd": {
    "problemStatement": "Sales teams currently lack a centralized location to store and access comprehensive company information, leading to scattered data across multiple systems and inefficient prospect research.",
    "goals": [
      "Provide a unified view of all company information in one location",
      "Enable quick updates to company data by any team member",
      "Improve data quality and completeness of company records"
    ],
    "successMetrics": [
      {
        "metric": "Company profile completeness rate",
        "target": "85% of active companies have 80%+ fields filled"
      },
      {
        "metric": "Time to update company information",
        "target": "Under 2 minutes per update"
      }
    ],
    "scope": {
      "inScope": [
        "Create company profiles with core business information",
        "Edit existing company profiles",
        "View company profile details",
        "Track company size, industry, and location data"
      ],
      "outOfScope": [
        "Automated company data enrichment (future phase)",
        "Company logo management (handled by media module)",
        "Financial data integration (separate initiative)"
      ]
    },
    "userStories": [
      "As a sales rep, I want to create comprehensive company profiles so that I can track all relevant business information in one place",
      "As a manager, I want to view complete company information so that I can quickly assess account potential"
    ],
    "dependencies": [
      "User authentication system must be complete",
      "Database schema for company entities must be finalized"
    ]
  },
  "issues": ["STORY-0001", "STORY-0002", "BUG-0001"],
  "owner": "Sarah Chen",
  "priority": "high",
  "metadata": {
    "createdAt": "2025-01-20T14:00:00Z",
    "updatedAt": "2025-01-25T10:30:00Z",
    "createdBy": "sarah.chen",
    "tags": ["companies", "profiles", "data-management"]
  }
}
